Table 4: Details on Allowance for Loan Losses and Actual Credit Losses,,,,,,,,,,
September 30 2024,,,,,,,,,,
,Wholesale Exposures,,,,,Retail Exposures,,,,
In millions of dollars,Financial Institutions,Commercial & Industrial,Other,Subtotal,Residential Mortgages and Real Estate Loans,Credit Cards,Other,Subtotal,Total,
Loans Past Due 90 Days And On Nonaccrual (1)(2),27,353,564,944,458,135,88,681,1625,
Loans Past Due 90 Days And Still Accruing,,79,11,90,120,2579,3,2702,2792,
Allowance for Loan Losses:,,,,,,,,,,
Attributable to Collectively Evaluated Impaired Loans,203,2063,185,2451,314,14050,1340,15704,18155,
Attributable to Individually Evaluated Impaired Loans,14,126,0,140,2,0,37,39,179,
Attributable to Purchased Credit-Impaired Loans,,,,-,(1),23,0,22,22,
Total Allowance For Loan Losses,217,2189,185,2591,315,14073,1377,15765,18356,
